rating,guest,trip_type,length_of_stay,title,review,review_date,country,stay_date,review_year,review_month,stay_year,stay_month,stopword_text,lemmatized_text,tokenized_text,hotel,channel,room_type,sentiment
10,eun,couple,2,a place want come next time,many accommodations ubud read lot reviews thought deciding staff friendly could imagine quality breakfast unbelievable price coffee juice bread main menu included cleanliness swimming pool rooms great satisfied staff smiled greeted made eye contact prabie reception particular treated kindly checkin checkout made feel good next time come ubud definitely want come back again highly recommend adiwana unagi,2/2/2024,south korea,1/1/2024,2024,february,2024,january,many accommodations ubud read lot reviews thought deciding staff friendly could imagine quality breakfast unbelievable price coffee juice bread main menu included cleanliness swimming pool rooms great satisfied staff smiled greeted made eye contact prabie reception particular treated kindly checkin checkout made feel good next time come ubud definitely want come back highly recommend adiwana unagi,many accommodation ubud read lot review thought deciding staff friendly could imagine quality breakfast unbelievable price coffee juice bread main menu included cleanliness swimming pool room great satisfied staff smiled greeted made eye contact prabie reception particular treated kindly checkin checkout made feel good next time come ubud definitely want come back again highly recommend adiwana unagi,"['many', 'accommodations', 'ubud', 'read', 'lot', 'reviews', 'thought', 'deciding', 'staff', 'friendly', 'could', 'imagine', 'quality', 'breakfast', 'unbelievable', 'price', 'coffee', 'juice', 'bread', 'main', 'menu', 'included', 'cleanliness', 'swimming', 'pool', 'rooms', 'great', 'satisfied', 'staff', 'smiled', 'greeted', 'made', 'eye', 'contact', 'prabie', 'reception', 'particular', 'treated', 'kindly', 'checkin', 'checkout', 'made', 'feel', 'good', 'next', 'time', 'come', 'ubud', 'definitely', 'want', 'come', 'back', 'again', 'highly', 'recommend', 'adiwana', 'unagi']",adiwana unagi suites,agoda,,pos
9.2,yoole,couple,2,good access downtown ubud,bedding rustling thanks shuttle service drops right next ubud royal palace easily tour also tour monkey forest attractions grab ride small amount money provide allday breakfast able breakfast menu room service 9 pm adjacent small road everything good except noise traffic eating restaurant,7/6/2024,south korea,7/1/2024,2024,july,2024,july,bedding rustling thanks shuttle service drops right next ubud royal palace easily tour also tour monkey forest attractions grab ride small amount money provide allday breakfast able breakfast menu room service 9 pm adjacent small road everything good except noise traffic eating restaurant,bedding rustling thanks shuttle service drop right next ubud royal palace easily tour also tour monkey forest attraction grab ride small amount money provide allday breakfast able breakfast menu room service 9 pm adjacent small road everything good except noise traffic eating restaurant,"['bedding', 'rustling', 'thanks', 'shuttle', 'service', 'drops', 'right', 'next', 'ubud', 'royal', 'palace', 'easily', 'tour', 'also', 'tour', 'monkey', 'forest', 'attractions', 'grab', 'ride', 'small', 'amount', 'money', 'provide', 'allday', 'breakfast', 'able', 'breakfast', 'menu', 'room', 'service', '9', 'pm', 'adjacent', 'small', 'road', 'everything', 'good', 'except', 'noise', 'traffic', 'eating', 'restaurant']",adiwana unagi suites,agoda,,pos
9.6,yerini,couple,1,want make reservation next time ubud haha,bit far downtown ubud shuttle grab inconvenience all fact quieter better little away swimming pool large quiet felt like really relaxing even carried suitcase room provided breakfast ellies kitchen located here delicious ate dinner best nasi goreng ive ever had see,5/8/2024,south korea,12/1/2023,2024,may,2023,december,bit far downtown ubud shuttle grab inconvenience fact quieter better little away swimming pool large quiet felt like really relaxing even carried suitcase room provided breakfast ellies kitchen located delicious ate dinner best nasi goreng ive ever see,bit far downtown ubud shuttle grab inconvenience all fact quieter better little away swimming pool large quiet felt like really relaxing even carried suitcase room provided breakfast ellies kitchen located here delicious ate dinner best nasi goreng ive ever had see,"['bit', 'far', 'downtown', 'ubud', 'shuttle', 'grab', 'inconvenience', 'all', 'fact', 'quieter', 'better', 'little', 'away', 'swimming', 'pool', 'large', 'quiet', 'felt', 'like', 'really', 'relaxing', 'even', 'carried', 'suitcase', 'room', 'provided', 'breakfast', 'ellies', 'kitchen', 'located', 'here', 'delicious', 'ate', 'dinner', 'best', 'nasi', 'goreng', 'ive', 'ever', 'had', 'see']",adiwana unagi suites,agoda,,pos
10,park,couple,1,hotel everything good,spacious clean rooms wellmaintained gardens quiet surroundings made feel healed photos came perfect swimming pool really nice staff friendly felt like supported trip shuttle bus connecting downtown ubud also easily accessible convenient sightseeing,10/3/2023,south korea,10/1/2023,2023,october,2023,october,spacious clean rooms wellmaintained gardens quiet surroundings made feel healed photos came perfect swimming pool really nice staff friendly felt like supported trip shuttle bus connecting downtown ubud also easily accessible convenient sightseeing,spacious clean room wellmaintained garden quiet surroundings made feel healed photo came perfect swimming pool really nice staff friendly felt like supported trip shuttle bus connecting downtown ubud also easily accessible convenient sightseeing,"['spacious', 'clean', 'rooms', 'wellmaintained', 'gardens', 'quiet', 'surroundings', 'made', 'feel', 'healed', 'photos', 'came', 'perfect', 'swimming', 'pool', 'really', 'nice', 'staff', 'friendly', 'felt', 'like', 'supported', 'trip', 'shuttle', 'bus', 'connecting', 'downtown', 'ubud', 'also', 'easily', 'accessible', 'convenient', 'sightseeing']",adiwana unagi suites,agoda,,pos
9.2,inyoung,family young children,1,friendly staff great,part straight road leading palace hotel washed away landslide 4wheel vehicles allowed enter take long way back compensated taking bike using hotel shuttle bit inconvenient however staff incredibly friendly food elys kitchen excellent good memories,8/7/2023,south korea,8/1/2023,2023,august,2023,august,part straight road leading palace hotel washed away landslide 4wheel vehicles allowed enter take long way back compensated taking bike using hotel shuttle bit inconvenient however staff incredibly friendly food elys kitchen excellent good memories,part straight road leading palace hotel washed away landslide 4wheel vehicle allowed enter take long way back compensated taking bike using hotel shuttle bit inconvenient however staff incredibly friendly food elys kitchen excellent good memory,"['part', 'straight', 'road', 'leading', 'palace', 'hotel', 'washed', 'away', 'landslide', '4wheel', 'vehicles', 'allowed', 'enter', 'take', 'long', 'way', 'back', 'compensated', 'taking', 'bike', 'using', 'hotel', 'shuttle', 'bit', 'inconvenient', 'however', 'staff', 'incredibly', 'friendly', 'food', 'elys', 'kitchen', 'excellent', 'good', 'memories']",adiwana unagi suites,agoda,,pos
10,miri,solo traveler,3,a resort helped enjoy wonderful vacation,great resort delicious food friendly staff convenient transportation hope place stays ubud forever,2/26/2024,south korea,2/1/2024,2024,february,2024,february,great resort delicious food friendly staff convenient transportation hope place stays ubud forever,great resort delicious food friendly staff convenient transportation hope place stay ubud forever,"['great', 'resort', 'delicious', 'food', 'friendly', 'staff', 'convenient', 'transportation', 'hope', 'place', 'stays', 'ubud', 'forever']",adiwana unagi suites,agoda,,pos
10,min,couple,1,recommended recommended recommended recommended recommended,honestly best place stayed entire bali trip staffs super accommodating suites amazingly clean spacious stuffy considering humid weather didnt see single mosquito ant inside room sad stayed one night spent well attending cooking painting classes would def recommend families couples,7/11/2024,south korea,7/1/2024,2024,july,2024,july,honestly best place stayed entire bali trip staffs super accommodating suites amazingly clean spacious stuffy considering humid weather didnt see single mosquito ant inside room sad stayed one night spent well attending cooking painting classes would def recommend families couples,honestly best place stayed entire bali trip staff super accommodating suite amazingly clean spacious stuffy considering humid weather didnt see single mosquito ant inside room sad stayed one night spent well attending cooking painting class would def recommend family couple,"['honestly', 'best', 'place', 'stayed', 'entire', 'bali', 'trip', 'staffs', 'super', 'accommodating', 'suites', 'amazingly', 'clean', 'spacious', 'stuffy', 'considering', 'humid', 'weather', 'didnt', 'see', 'single', 'mosquito', 'ant', 'inside', 'room', 'sad', 'stayed', 'one', 'night', 'spent', 'well', 'attending', 'cooking', 'painting', 'classes', 'would', 'def', 'recommend', 'families', 'couples']",adiwana unagi suites,agoda,,pos
9.6,insu,couple,2,great,willingness visit 200 satisfied friendliness comfort dining price,10/23/2024,south korea,10/1/2024,2024,october,2024,october,willingness visit 200 satisfied friendliness comfort dining price,willingness visit 200 satisfied friendliness comfort dining price,"['willingness', 'visit', '200', 'satisfied', 'friendliness', 'comfort', 'dining', 'price']",adiwana unagi suites,agoda,,pos
10,hayoung,couple,1,i definitely want go again,definitely go haha i made lot money,10/13/2024,south korea,10/1/2024,2024,october,2024,october,definitely go haha made lot money,definitely go haha i made lot money,"['definitely', 'go', 'haha', 'i', 'made', 'lot', 'money']",adiwana unagi suites,agoda,,pos
10,ahyun,couple,2,recommended,although far city center near palace many good restaurants nearby including alice kitchen lobby free shuttle easy get around everyone kind welcoming enjoyable stay,10/9/2024,south korea,10/1/2024,2024,october,2024,october,although far city center near palace many good restaurants nearby including alice kitchen lobby free shuttle easy get around everyone kind welcoming enjoyable stay,although far city center near palace many good restaurant nearby including alice kitchen lobby free shuttle easy get around everyone kind welcoming enjoyable stay,"['although', 'far', 'city', 'center', 'near', 'palace', 'many', 'good', 'restaurants', 'nearby', 'including', 'alice', 'kitchen', 'lobby', 'free', 'shuttle', 'easy', 'get', 'around', 'everyone', 'kind', 'welcoming', 'enjoyable', 'stay']",adiwana unagi suites,agoda,,pos
8.4,sanghoon,couple,4,great place experience ubud,accommodation pool view nice great quiet rest nice breakfast brought room delicious staff friendly recommend it,10/3/2024,south korea,1/1/2024,2024,october,2024,january,accommodation pool view nice great quiet rest nice breakfast brought room delicious staff friendly recommend,accommodation pool view nice great quiet rest nice breakfast brought room delicious staff friendly recommend it,"['accommodation', 'pool', 'view', 'nice', 'great', 'quiet', 'rest', 'nice', 'breakfast', 'brought', 'room', 'delicious', 'staff', 'friendly', 'recommend', 'it']",adiwana unagi suites,agoda,,pos
9.6,hana,family young children,3,perfect,second visit bali second visit adiwana unagido well managed friendly clean worry bugs food delicious room spacious nice allday breakfast lunch dinner depending schedule,9/4/2024,south korea,9/1/2024,2024,september,2024,september,second visit bali second visit adiwana unagido well managed friendly clean worry bugs food delicious room spacious nice allday breakfast lunch dinner depending schedule,second visit bali second visit adiwana unagido well managed friendly clean worry bug food delicious room spacious nice allday breakfast lunch dinner depending schedule,"['second', 'visit', 'bali', 'second', 'visit', 'adiwana', 'unagido', 'well', 'managed', 'friendly', 'clean', 'worry', 'bugs', 'food', 'delicious', 'room', 'spacious', 'nice', 'allday', 'breakfast', 'lunch', 'dinner', 'depending', 'schedule']",adiwana unagi suites,agoda,,pos
8,jong,family young children,1,accommodation delicious breakfast,location bit disappointing good value money fortunate buggy ride royal palace hotel nice swimming pool forest,8/29/2024,south korea,2/1/2024,2024,august,2024,february,location bit disappointing good value money fortunate buggy ride royal palace hotel nice swimming pool forest,location bit disappointing good value money fortunate buggy ride royal palace hotel nice swimming pool forest,"['location', 'bit', 'disappointing', 'good', 'value', 'money', 'fortunate', 'buggy', 'ride', 'royal', 'palace', 'hotel', 'nice', 'swimming', 'pool', 'forest']",adiwana unagi suites,agoda,,pos
10,yeongju,couple,2,room clean cool friendly,room cool clean staff friendly breakfast delicious go pool villa much fun floating bean bags satisfied price,8/26/2024,south korea,3/1/2024,2024,august,2024,march,room cool clean staff friendly breakfast delicious go pool villa much fun floating bean bags satisfied price,room cool clean staff friendly breakfast delicious go pool villa much fun floating bean bag satisfied price,"['room', 'cool', 'clean', 'staff', 'friendly', 'breakfast', 'delicious', 'go', 'pool', 'villa', 'much', 'fun', 'floating', 'bean', 'bags', 'satisfied', 'price']",adiwana unagi suites,agoda,,pos
10,hyunzi,couple,2,friendly clean truly best choice,staff friendly responsive comfortable nice pool nice breakfast delicious,8/10/2024,south korea,8/1/2024,2024,august,2024,august,staff friendly responsive comfortable nice pool nice breakfast delicious,staff friendly responsive comfortable nice pool nice breakfast delicious,"['staff', 'friendly', 'responsive', 'comfortable', 'nice', 'pool', 'nice', 'breakfast', 'delicious']",adiwana unagi suites,agoda,,pos
9.6,eunbit,group,1,private resort enjoy,facilities big could enjoy privately great able breakfast room service,8/3/2024,south korea,7/1/2024,2024,august,2024,july,facilities big could enjoy privately great able breakfast room service,facility big could enjoy privately great able breakfast room service,"['facilities', 'big', 'could', 'enjoy', 'privately', 'great', 'able', 'breakfast', 'room', 'service']",adiwana unagi suites,agoda,,pos
10,jihyun,family young children,3,pool villa good,room condition good blanket bit musty thought bali completely satisfied willing use next time water cold need rent pool villa july august,8/3/2024,south korea,7/1/2024,2024,august,2024,july,room condition good blanket bit musty thought bali completely satisfied willing use next time water cold need rent pool villa july august,room condition good blanket bit musty thought bali completely satisfied willing use next time water cold need rent pool villa july august,"['room', 'condition', 'good', 'blanket', 'bit', 'musty', 'thought', 'bali', 'completely', 'satisfied', 'willing', 'use', 'next', 'time', 'water', 'cold', 'need', 'rent', 'pool', 'villa', 'july', 'august']",adiwana unagi suites,agoda,,pos
10,,couple,2,great,recommend,7/26/2024,south korea,7/1/2024,2024,july,2024,july,recommend,recommend,['recommend'],adiwana unagi suites,agoda,,pos
10,miyoung,couple,2,neat accommodation,first all nice far downtown ubud easy get from meals breakfast delicious although facilities large accommodation everything need,7/19/2024,south korea,7/1/2024,2024,july,2024,july,first nice far downtown ubud easy get meals breakfast delicious although facilities large accommodation everything need,first all nice far downtown ubud easy get from meal breakfast delicious although facility large accommodation everything need,"['first', 'all', 'nice', 'far', 'downtown', 'ubud', 'easy', 'get', 'from', 'meals', 'breakfast', 'delicious', 'although', 'facilities', 'large', 'accommodation', 'everything', 'need']",adiwana unagi suites,agoda,,pos
10,charmi,couple,1,best hotel want come back sometime later  ,super friendly staffs helpful entire stay loved interior resort too visited quite hotels trip adiwana unagi far best resort visited trip thank tusan made trip memorable guest services incredible,7/18/2024,south korea,7/1/2024,2024,july,2024,july,super friendly staffs helpful entire stay loved interior resort visited quite hotels trip adiwana unagi far best resort visited trip thank tusan made trip memorable guest services incredible,super friendly staff helpful entire stay loved interior resort too visited quite hotel trip adiwana unagi far best resort visited trip thank tusan made trip memorable guest service incredible,"['super', 'friendly', 'staffs', 'helpful', 'entire', 'stay', 'loved', 'interior', 'resort', 'too', 'visited', 'quite', 'hotels', 'trip', 'adiwana', 'unagi', 'far', 'best', 'resort', 'visited', 'trip', 'thank', 'tusan', 'made', 'trip', 'memorable', 'guest', 'services', 'incredible']",adiwana unagi suites,agoda,,pos
10,haejung,group,2,quiet friendly staff,quiet staff friendly swimming pool nice use liked breakfast cooked warm delicious could eat whenever wherever wanted location perfect far city center free shuttle service,7/7/2024,south korea,6/1/2024,2024,july,2024,june,quiet staff friendly swimming pool nice use liked breakfast cooked warm delicious could eat whenever wherever wanted location perfect far city center free shuttle service,quiet staff friendly swimming pool nice use liked breakfast cooked warm delicious could eat whenever wherever wanted location perfect far city center free shuttle service,"['quiet', 'staff', 'friendly', 'swimming', 'pool', 'nice', 'use', 'liked', 'breakfast', 'cooked', 'warm', 'delicious', 'could', 'eat', 'whenever', 'wherever', 'wanted', 'location', 'perfect', 'far', 'city', 'center', 'free', 'shuttle', 'service']",adiwana unagi suites,agoda,,pos
10,soonran,couple,2,best place ubud,husband enjoyed time lot kind staff well organized facilities great food revisit chance go bali appreciated staff  made good memory,6/28/2024,south korea,6/1/2024,2024,june,2024,june,husband enjoyed time lot kind staff well organized facilities great food revisit chance go bali appreciated staff made good memory,husband enjoyed time lot kind staff well organized facility great food revisit chance go bali appreciated staff made good memory,"['husband', 'enjoyed', 'time', 'lot', 'kind', 'staff', 'well', 'organized', 'facilities', 'great', 'food', 'revisit', 'chance', 'go', 'bali', 'appreciated', 'staff', 'made', 'good', 'memory']",adiwana unagi suites,agoda,,pos
7.6,youngki,couple,2,a room feeling,private room type,6/22/2024,south korea,5/1/2024,2024,june,2024,may,private room type,private room type,"['private', 'room', 'type']",adiwana unagi suites,agoda,,pos
8.8,sumin,group,2,have good rest,although location accommodation bit ambiguous shuttle time good feel much inconvenience close alhas harum saved grab costs,6/21/2024,south korea,6/1/2024,2024,june,2024,june,although location accommodation bit ambiguous shuttle time good feel much inconvenience close alhas harum saved grab costs,although location accommodation bit ambiguous shuttle time good feel much inconvenience close alhas harum saved grab cost,"['although', 'location', 'accommodation', 'bit', 'ambiguous', 'shuttle', 'time', 'good', 'feel', 'much', 'inconvenience', 'close', 'alhas', 'harum', 'saved', 'grab', 'costs']",adiwana unagi suites,agoda,,pos
8.4,,family young children,3,all good memories ubud accommodation,friendly staff ubud bedding got damp quickly grateful changed every time asked okay think best memories ubud least accommodation,6/19/2024,south korea,12/1/2023,2024,june,2023,december,friendly staff ubud bedding got damp quickly grateful changed every time asked okay think best memories ubud least accommodation,friendly staff ubud bedding got damp quickly grateful changed every time asked okay think best memory ubud least accommodation,"['friendly', 'staff', 'ubud', 'bedding', 'got', 'damp', 'quickly', 'grateful', 'changed', 'every', 'time', 'asked', 'okay', 'think', 'best', 'memories', 'ubud', 'least', 'accommodation']",adiwana unagi suites,agoda,,pos
9.2,donggwang,family young children,3,satisfying,good people good food comfortable stay,6/17/2024,south korea,6/1/2024,2024,june,2024,june,good people good food comfortable stay,good people good food comfortable stay,"['good', 'people', 'good', 'food', 'comfortable', 'stay']",adiwana unagi suites,agoda,,pos
10,jooyoung,couple,3,a must go place again,friendly staff beautiful accommodation delicious breakfast restaurant nothing missing yande cute kind strong friend haha,6/8/2024,south korea,5/1/2024,2024,june,2024,may,friendly staff beautiful accommodation delicious breakfast restaurant nothing missing yande cute kind strong friend haha,friendly staff beautiful accommodation delicious breakfast restaurant nothing missing yande cute kind strong friend haha,"['friendly', 'staff', 'beautiful', 'accommodation', 'delicious', 'breakfast', 'restaurant', 'nothing', 'missing', 'yande', 'cute', 'kind', 'strong', 'friend', 'haha']",adiwana unagi suites,agoda,,pos
10,hajin,solo traveler,1,i think go go ubud,satisfied breakfast dinner restaurant although swimming pool small enough fun,5/15/2024,south korea,5/1/2024,2024,may,2024,may,satisfied breakfast dinner restaurant although swimming pool small enough fun,satisfied breakfast dinner restaurant although swimming pool small enough fun,"['satisfied', 'breakfast', 'dinner', 'restaurant', 'although', 'swimming', 'pool', 'small', 'enough', 'fun']",adiwana unagi suites,agoda,,pos
10,jihoon,couple,2,i really like it,staff friendly massage good food ellies kitchen delicious,5/3/2024,south korea,5/1/2024,2024,may,2024,may,staff friendly massage good food ellies kitchen delicious,staff friendly massage good food ellies kitchen delicious,"['staff', 'friendly', 'massage', 'good', 'food', 'ellies', 'kitchen', 'delicious']",adiwana unagi suites,agoda,,pos
10,,couple,2,unagi best,first time coming ubud honeymoon bali accommodation great staff friendly welcome drink good cleanliness good breakfast delicious pool view nice bugs yande ngurah people charge service room cleaning really friendly nice think ill come next time,4/26/2024,south korea,4/1/2024,2024,april,2024,april,first time coming ubud honeymoon bali accommodation great staff friendly welcome drink good cleanliness good breakfast delicious pool view nice bugs yande ngurah people charge service room cleaning really friendly nice think ill come next time,first time coming ubud honeymoon bali accommodation great staff friendly welcome drink good cleanliness good breakfast delicious pool view nice bug yande ngurah people charge service room cleaning really friendly nice think ill come next time,"['first', 'time', 'coming', 'ubud', 'honeymoon', 'bali', 'accommodation', 'great', 'staff', 'friendly', 'welcome', 'drink', 'good', 'cleanliness', 'good', 'breakfast', 'delicious', 'pool', 'view', 'nice', 'bugs', 'yande', 'ngurah', 'people', 'charge', 'service', 'room', 'cleaning', 'really', 'friendly', 'nice', 'think', 'ill', 'come', 'next', 'time']",adiwana unagi suites,agoda,,pos
10,,couple,2,best honeymoon experience,place felt good staff met smiled greeted me jungle view swimming pool great breakfast good too since checking early morning requested boxed breakfast gave boxed breakfast enjoyed gili river made reservation cooking class thought little expensive receiving it worth all recommend like cooking next time go ubud want visit again,4/14/2024,south korea,4/1/2024,2024,april,2024,april,place felt good staff met smiled greeted jungle view swimming pool great breakfast good since checking early morning requested boxed breakfast gave boxed breakfast enjoyed gili river made reservation cooking class thought little expensive receiving worth recommend like cooking next time go ubud want visit,place felt good staff met smiled greeted me jungle view swimming pool great breakfast good too since checking early morning requested boxed breakfast gave boxed breakfast enjoyed gili river made reservation cooking class thought little expensive receiving it worth all recommend like cooking next time go ubud want visit again,"['place', 'felt', 'good', 'staff', 'met', 'smiled', 'greeted', 'me', 'jungle', 'view', 'swimming', 'pool', 'great', 'breakfast', 'good', 'too', 'since', 'checking', 'early', 'morning', 'requested', 'boxed', 'breakfast', 'gave', 'boxed', 'breakfast', 'enjoyed', 'gili', 'river', 'made', 'reservation', 'cooking', 'class', 'thought', 'little', 'expensive', 'receiving', 'it', 'worth', 'all', 'recommend', 'like', 'cooking', 'next', 'time', 'go', 'ubud', 'want', 'visit', 'again']",adiwana unagi suites,agoda,,pos
8.4,hyojeong,family young children,2,i went family trip,planned trip bali 6 nights 8 days went trip 15monthold baby staff friendly experience inconvenience using it since ubud small ants,4/6/2024,south korea,4/1/2024,2024,april,2024,april,planned trip bali 6 nights 8 days went trip 15monthold baby staff friendly experience inconvenience using since ubud small ants,planned trip bali 6 night 8 day went trip 15monthold baby staff friendly experience inconvenience using it since ubud small ant,"['planned', 'trip', 'bali', '6', 'nights', '8', 'days', 'went', 'trip', '15monthold', 'baby', 'staff', 'friendly', 'experience', 'inconvenience', 'using', 'it', 'since', 'ubud', 'small', 'ants']",adiwana unagi suites,agoda,,pos
