rating,guest,trip_type,length_of_stay,title,review,review_date,country,stay_date,review_year,review_month,stay_year,stay_month,stopword_text,lemmatized_text,tokenized_text,hotel,channel,room_type,sentiment
8,habreus,family,3,very good,we received a message that we would have been chosen for a room upgrade on the first night when we arrived at the hotel it was not an upgrade it was a lower room than our reservation before even complaining at the front desk they advised that they would move us from room the next day to one of the same category as our booking but at no time did we stay in the room we booked the hotel could have informed better that it had some problem rather than trying to trick us with an upgrade that did not exist despite the problem the hotel is good and the two rooms we stayed in were cozy very beautiful hotel cozy room very attentive staff good food at breakfast and also in the hotel restaurant,9/22/2023,brazil,9/1/2023,2023,september,2023,september,received message would chosen room upgrade first night arrived hotel upgrade lower room reservation even complaining front desk advised would move us room next day one category booking time stay room booked hotel could informed better problem rather trying trick us upgrade exist despite problem hotel good two rooms stayed cozy beautiful hotel cozy room attentive staff good food breakfast also hotel restaurant,we received a message that we would have been chosen for a room upgrade on the first night when we arrived at the hotel it wa not an upgrade it wa a lower room than our reservation before even complaining at the front desk they advised that they would move u from room the next day to one of the same category a our booking but at no time did we stay in the room we booked the hotel could have informed better that it had some problem rather than trying to trick u with an upgrade that did not exist despite the problem the hotel is good and the two room we stayed in were cozy very beautiful hotel cozy room very attentive staff good food at breakfast and also in the hotel restaurant,"['we', 'received', 'a', 'message', 'that', 'we', 'would', 'have', 'been', 'chosen', 'for', 'a', 'room', 'upgrade', 'on', 'the', 'first', 'night', 'when', 'we', 'arrived', 'at', 'the', 'hotel', 'it', 'was', 'not', 'an', 'upgrade', 'it', 'was', 'a', 'lower', 'room', 'than', 'our', 'reservation', 'before', 'even', 'complaining', 'at', 'the', 'front', 'desk', 'they', 'advised', 'that', 'they', 'would', 'move', 'us', 'from', 'room', 'the', 'next', 'day', 'to', 'one', 'of', 'the', 'same', 'category', 'as', 'our', 'booking', 'but', 'at', 'no', 'time', 'did', 'we', 'stay', 'in', 'the', 'room', 'we', 'booked', 'the', 'hotel', 'could', 'have', 'informed', 'better', 'that', 'it', 'had', 'some', 'problem', 'rather', 'than', 'trying', 'to', 'trick', 'us', 'with', 'an', 'upgrade', 'that', 'did', 'not', 'exist', 'despite', 'the', 'problem', 'the', 'hotel', 'is', 'good', 'and', 'the', 'two', 'rooms', 'we', 'stayed', 'in', 'were', 'cozy', 'very', 'beautiful', 'hotel', 'cozy', 'room', 'very', 'attentive', 'staff', 'good', 'food', 'at', 'breakfast', 'and', 'also', 'in', 'the', 'hotel', 'restaurant']",adiwana unagi suites,booking.com,unagi suite,pos
9,malle,couple,5,superb stay,"a small downside if you have noisy neighbors you may hear them a great hotel really lovely staff always ready to help you hyper responsive on whatsapp for all your requests the pool is beautiful with a great view of the forest the same goes for the spa the room is very spacious nicely decorated with a very comfortable and very large bed the activities offered by the hotel are also very cool especially the bike tour in the rice fields
the hotel is located a little outside the center of ubud quiet but quickly accessible by scooter",9/21/2023,france,9/1/2023,2023,september,2023,september,small downside noisy neighbors may hear great hotel really lovely staff always ready help hyper responsive whatsapp requests pool beautiful great view forest goes spa room spacious nicely decorated comfortable large bed activities offered hotel also cool especially bike tour rice fields hotel located little outside center ubud quiet quickly accessible scooter,a small downside if you have noisy neighbor you may hear them a great hotel really lovely staff always ready to help you hyper responsive on whatsapp for all your request the pool is beautiful with a great view of the forest the same go for the spa the room is very spacious nicely decorated with a very comfortable and very large bed the activity offered by the hotel are also very cool especially the bike tour in the rice field the hotel is located a little outside the center of ubud quiet but quickly accessible by scooter,"['a', 'small', 'downside', 'if', 'you', 'have', 'noisy', 'neighbors', 'you', 'may', 'hear', 'them', 'a', 'great', 'hotel', 'really', 'lovely', 'staff', 'always', 'ready', 'to', 'help', 'you', 'hyper', 'responsive', 'on', 'whatsapp', 'for', 'all', 'your', 'requests', 'the', 'pool', 'is', 'beautiful', 'with', 'a', 'great', 'view', 'of', 'the', 'forest', 'the', 'same', 'goes', 'for', 'the', 'spa', 'the', 'room', 'is', 'very', 'spacious', 'nicely', 'decorated', 'with', 'a', 'very', 'comfortable', 'and', 'very', 'large', 'bed', 'the', 'activities', 'offered', 'by', 'the', 'hotel', 'are', 'also', 'very', 'cool', 'especially', 'the', 'bike', 'tour', 'in', 'the', 'rice', 'fields', 'the', 'hotel', 'is', 'located', 'a', 'little', 'outside', 'the', 'center', 'of', 'ubud', 'quiet', 'but', 'quickly', 'accessible', 'by', 'scooter']",adiwana unagi suites,booking.com,adiwana forest view,pos
10,erika,couple,1,exceptional,"nothing everything was perfect everything was wonderful an experience to have without a doubt 
the staff the environment the food the pool all to perfection ",9/16/2023,italy,9/1/2023,2023,september,2023,september,nothing everything perfect everything wonderful experience without doubt staff environment food pool perfection,nothing everything wa perfect everything wa wonderful an experience to have without a doubt the staff the environment the food the pool all to perfection,"['nothing', 'everything', 'was', 'perfect', 'everything', 'was', 'wonderful', 'an', 'experience', 'to', 'have', 'without', 'a', 'doubt', 'the', 'staff', 'the', 'environment', 'the', 'food', 'the', 'pool', 'all', 'to', 'perfection']",adiwana unagi suites,booking.com,unagi suite,pos
10,ramona,couple,6,"beautiful place to stay in ubub, unique service ",there is absolutely nothing to complain about the breakfast was a 10 out of 10 delicious and absolutely great offer,9/12/2023,germany,9/1/2023,2023,september,2023,september,absolutely nothing complain breakfast 10 10 delicious absolutely great offer,there is absolutely nothing to complain about the breakfast wa a 10 out of 10 delicious and absolutely great offer,"['there', 'is', 'absolutely', 'nothing', 'to', 'complain', 'about', 'the', 'breakfast', 'was', 'a', '10', 'out', 'of', '10', 'delicious', 'and', 'absolutely', 'great', 'offer']",adiwana unagi suites,booking.com,adiwana pool access,pos
9,felix,couple,4,very nice stay,the towels are already a bit worn out very friendly staff the hotel was very well maintained the skylounge and view were really much better than the main restaurant,9/7/2023,germany,9/1/2023,2023,september,2023,september,towels already bit worn friendly staff hotel well maintained skylounge view really much better main restaurant,the towel are already a bit worn out very friendly staff the hotel wa very well maintained the skylounge and view were really much better than the main restaurant,"['the', 'towels', 'are', 'already', 'a', 'bit', 'worn', 'out', 'very', 'friendly', 'staff', 'the', 'hotel', 'was', 'very', 'well', 'maintained', 'the', 'skylounge', 'and', 'view', 'were', 'really', 'much', 'better', 'than', 'the', 'main', 'restaurant']",adiwana unagi suites,booking.com,unagi suite,pos
8,christoph,couple,4,great stay,"you notice in some places that the hotel is a bit dated the staff is incredibly friendly and helpful you feel immediately welcome and comfortable here free shuttle to ubud center there was also a free afternoon tea with daily changing country specialties
the rooms are very large and the a la carte breakfast is served all day which is very convenient for longer trips",9/6/2023,germany,9/1/2023,2023,september,2023,september,notice places hotel bit dated staff incredibly friendly helpful feel immediately welcome comfortable free shuttle ubud center also free afternoon tea daily changing country specialties rooms large la carte breakfast served day convenient longer trips,you notice in some place that the hotel is a bit dated the staff is incredibly friendly and helpful you feel immediately welcome and comfortable here free shuttle to ubud center there wa also a free afternoon tea with daily changing country specialty the room are very large and the a la carte breakfast is served all day which is very convenient for longer trip,"['you', 'notice', 'in', 'some', 'places', 'that', 'the', 'hotel', 'is', 'a', 'bit', 'dated', 'the', 'staff', 'is', 'incredibly', 'friendly', 'and', 'helpful', 'you', 'feel', 'immediately', 'welcome', 'and', 'comfortable', 'here', 'free', 'shuttle', 'to', 'ubud', 'center', 'there', 'was', 'also', 'a', 'free', 'afternoon', 'tea', 'with', 'daily', 'changing', 'country', 'specialties', 'the', 'rooms', 'are', 'very', 'large', 'and', 'the', 'a', 'la', 'carte', 'breakfast', 'is', 'served', 'all', 'day', 'which', 'is', 'very', 'convenient', 'for', 'longer', 'trips']",adiwana unagi suites,booking.com,unagi suite,pos
9,marlene,couple,2,wonderful,very noisy in the building by the pool nice rooms and helpful staff,8/31/2023,denmark,8/1/2023,2023,august,2023,august,noisy building pool nice rooms helpful staff,very noisy in the building by the pool nice room and helpful staff,"['very', 'noisy', 'in', 'the', 'building', 'by', 'the', 'pool', 'nice', 'rooms', 'and', 'helpful', 'staff']",adiwana unagi suites,booking.com,adiwana pool access,pos
10,giada,couple,3,dream facility,"nothing everything the staff is super friendly and helpful 
the room was fantastic directly overlooking the pool structure complete with all the comforts and even vegan breakfast options which is not obvious
it was a perfect stay",8/27/2023,italy,8/1/2023,2023,august,2023,august,nothing everything staff super friendly helpful room fantastic directly overlooking pool structure complete comforts even vegan breakfast options obvious perfect stay,nothing everything the staff is super friendly and helpful the room wa fantastic directly overlooking the pool structure complete with all the comfort and even vegan breakfast option which is not obvious it wa a perfect stay,"['nothing', 'everything', 'the', 'staff', 'is', 'super', 'friendly', 'and', 'helpful', 'the', 'room', 'was', 'fantastic', 'directly', 'overlooking', 'the', 'pool', 'structure', 'complete', 'with', 'all', 'the', 'comforts', 'and', 'even', 'vegan', 'breakfast', 'options', 'which', 'is', 'not', 'obvious', 'it', 'was', 'a', 'perfect', 'stay']",adiwana unagi suites,booking.com,adiwana pool access,pos
10,al,couple,4,outstanding beautiful hotel with super friendly and helpful staff,"everything was really great there was a small drawback however which unfortunately could not be solved the toilet in the hotel room is not separated airtight but by an open glass door at the top thats basically not bad but there was a drain in the floor from which it smelled very strongly of stale sewage here however it is not the cleaners fault they have been diligent and repeatedly thoroughly cleaned as i requested however it started to stink again later after a few hours probably due to the poor construction of the tube joints everything was almost perfect room balcony view cleanliness design of the room leisure activities communication very friendly competent and helpful hotel staff  especially reception cleaning catering 
when booking with breakfast they provide delivery to the room at no extra cost there is also a free afternoon tea
i also found the possibility to communicate via whatsapp which could regulate all concerns very convenient
i will definitely be back",8/11/2023,germany,8/1/2023,2023,august,2023,august,everything really great small drawback however unfortunately could solved toilet hotel room separated airtight open glass door top thats basically bad drain floor smelled strongly stale sewage however cleaners fault diligent repeatedly thoroughly cleaned requested however started stink later hours probably due poor construction tube joints everything almost perfect room balcony view cleanliness design room leisure activities communication friendly competent helpful hotel staff especially reception cleaning catering booking breakfast provide delivery room extra cost also free afternoon tea also found possibility communicate via whatsapp could regulate concerns convenient definitely back,everything wa really great there wa a small drawback however which unfortunately could not be solved the toilet in the hotel room is not separated airtight but by an open glass door at the top thats basically not bad but there wa a drain in the floor from which it smelled very strongly of stale sewage here however it is not the cleaner fault they have been diligent and repeatedly thoroughly cleaned a i requested however it started to stink again later after a few hour probably due to the poor construction of the tube joint everything wa almost perfect room balcony view cleanliness design of the room leisure activity communication very friendly competent and helpful hotel staff especially reception cleaning catering when booking with breakfast they provide delivery to the room at no extra cost there is also a free afternoon tea i also found the possibility to communicate via whatsapp which could regulate all concern very convenient i will definitely be back,"['everything', 'was', 'really', 'great', 'there', 'was', 'a', 'small', 'drawback', 'however', 'which', 'unfortunately', 'could', 'not', 'be', 'solved', 'the', 'toilet', 'in', 'the', 'hotel', 'room', 'is', 'not', 'separated', 'airtight', 'but', 'by', 'an', 'open', 'glass', 'door', 'at', 'the', 'top', 'thats', 'basically', 'not', 'bad', 'but', 'there', 'was', 'a', 'drain', 'in', 'the', 'floor', 'from', 'which', 'it', 'smelled', 'very', 'strongly', 'of', 'stale', 'sewage', 'here', 'however', 'it', 'is', 'not', 'the', 'cleaners', 'fault', 'they', 'have', 'been', 'diligent', 'and', 'repeatedly', 'thoroughly', 'cleaned', 'as', 'i', 'requested', 'however', 'it', 'started', 'to', 'stink', 'again', 'later', 'after', 'a', 'few', 'hours', 'probably', 'due', 'to', 'the', 'poor', 'construction', 'of', 'the', 'tube', 'joints', 'everything', 'was', 'almost', 'perfect', 'room', 'balcony', 'view', 'cleanliness', 'design', 'of', 'the', 'room', 'leisure', 'activities', 'communication', 'very', 'friendly', 'competent', 'and', 'helpful', 'hotel', 'staff', 'especially', 'reception', 'cleaning', 'catering', 'when', 'booking', 'with', 'breakfast', 'they', 'provide', 'delivery', 'to', 'the', 'room', 'at', 'no', 'extra', 'cost', 'there', 'is', 'also', 'a', 'free', 'afternoon', 'tea', 'i', 'also', 'found', 'the', 'possibility', 'to', 'communicate', 'via', 'whatsapp', 'which', 'could', 'regulate', 'all', 'concerns', 'very', 'convenient', 'i', 'will', 'definitely', 'be', 'back']",adiwana unagi suites,booking.com,adiwana forest view,pos
9,kilani,family,2,leaving to be one of the best,breakfast not too rich see not even too varied setting staff service,8/10/2023,tunisia,8/1/2023,2023,august,2023,august,breakfast rich see even varied setting staff service,breakfast not too rich see not even too varied setting staff service,"['breakfast', 'not', 'too', 'rich', 'see', 'not', 'even', 'too', 'varied', 'setting', 'staff', 'service']",adiwana unagi suites,booking.com,adiwana pool access,neg
9,febe,couple,4,"beautiful, well-kept hotel with good service.","food in the restaurant in elys kitchen is very good nevertheless we found the setting less cozy huge room very clean 
friendly staff beautiful pool 
the spa is also worth a visit",7/29/2023,belgium,7/1/2023,2023,july,2023,july,food restaurant elys kitchen good nevertheless found setting less cozy huge room clean friendly staff beautiful pool spa also worth visit,food in the restaurant in elys kitchen is very good nevertheless we found the setting less cozy huge room very clean friendly staff beautiful pool the spa is also worth a visit,"['food', 'in', 'the', 'restaurant', 'in', 'elys', 'kitchen', 'is', 'very', 'good', 'nevertheless', 'we', 'found', 'the', 'setting', 'less', 'cozy', 'huge', 'room', 'very', 'clean', 'friendly', 'staff', 'beautiful', 'pool', 'the', 'spa', 'is', 'also', 'worth', 'a', 'visit']",adiwana unagi suites,booking.com,club room,pos
10,benjamin,couple,5,exceptional,nothing lovely staff free shuttle to ubud centre daily touches room and pool in absolutely fantastic location,7/23/2023,france,7/1/2023,2023,july,2023,july,nothing lovely staff free shuttle ubud centre daily touches room pool absolutely fantastic location,nothing lovely staff free shuttle to ubud centre daily touch room and pool in absolutely fantastic location,"['nothing', 'lovely', 'staff', 'free', 'shuttle', 'to', 'ubud', 'centre', 'daily', 'touches', 'room', 'and', 'pool', 'in', 'absolutely', 'fantastic', 'location']",adiwana unagi suites,booking.com,adiwana forest view,neg
10,rosamary,couple,5,totally recommended.,nothing everything,7/14/2023,chile,7/1/2023,2023,july,2023,july,nothing everything,nothing everything,"['nothing', 'everything']",adiwana unagi suites,booking.com,one-bedroom villa with private pool,pos
8,rupa,couple,3,top stay!,breakfast was good only a pity that it is a la carte and can not take staff was super friendly and helpful were right there for you if you needed anything rooms were super nice with outdoor shower location was a bit remote but fortunately they had a shuttle bus that brought downtown i would definitely come back here,6/21/2023,netherlands,6/1/2023,2023,june,2023,june,breakfast good pity la carte take staff super friendly helpful right needed anything rooms super nice outdoor shower location bit remote fortunately shuttle bus brought downtown would definitely come back,breakfast wa good only a pity that it is a la carte and can not take staff wa super friendly and helpful were right there for you if you needed anything room were super nice with outdoor shower location wa a bit remote but fortunately they had a shuttle bus that brought downtown i would definitely come back here,"['breakfast', 'was', 'good', 'only', 'a', 'pity', 'that', 'it', 'is', 'a', 'la', 'carte', 'and', 'can', 'not', 'take', 'staff', 'was', 'super', 'friendly', 'and', 'helpful', 'were', 'right', 'there', 'for', 'you', 'if', 'you', 'needed', 'anything', 'rooms', 'were', 'super', 'nice', 'with', 'outdoor', 'shower', 'location', 'was', 'a', 'bit', 'remote', 'but', 'fortunately', 'they', 'had', 'a', 'shuttle', 'bus', 'that', 'brought', 'downtown', 'i', 'would', 'definitely', 'come', 'back', 'here']",adiwana unagi suites,booking.com,unagi suite,pos
9,peter,couple,2,nice place,toilet without a roof idyllic,6/19/2023,denmark,6/1/2023,2023,june,2023,june,toilet without roof idyllic,toilet without a roof idyllic,"['toilet', 'without', 'a', 'roof', 'idyllic']",adiwana unagi suites,booking.com,club room,pos
10,krcpr,family,12,paradise,"nothing hello adiwana unagi suites 

it is not a hotel but a haven of peace surrounded by nature and calm 

the staff is so nice sweet caring 

the breakfasts are very good and very neat you get a cold drink a hot drink a plate of fruit croissants and dishes wide choice 

its very clean cleaning is done constantly 

the city center is about 30 minutes walk from the hotel they have a shuttle that can take you there and come back to pick you up its a shame that the shuttle can not pick up after 9 pm and its a shame its not every hour 

every night we were delivered fresh cookies with a story of bali its really very cute 

we chose the villa with pool its a very spacious and beautiful room 
what is a shame is that we hear everything because it is poorly insulated and we couldnt enjoy our private pool as it didnt get the sun 

as soon as i had a problem they did their best to help me 

thank you to adiwana staff you made this trip a dream of heaven",6/17/2023,france,6/1/2023,2023,june,2023,june,nothing hello adiwana unagi suites hotel peace surrounded nature calm staff nice sweet caring breakfasts good neat get cold drink hot drink plate fruit croissants dishes wide choice clean cleaning done constantly city center 30 minutes walk hotel shuttle take come back pick shame shuttle pick 9 pm shame every hour every night delivered fresh cookies story bali really cute chose villa pool spacious beautiful room shame hear everything poorly insulated couldnt enjoy private pool didnt get sun soon problem best help thank adiwana staff made trip dream heaven,nothing hello adiwana unagi suite it is not a hotel but a haven of peace surrounded by nature and calm the staff is so nice sweet caring the breakfast are very good and very neat you get a cold drink a hot drink a plate of fruit croissant and dish wide choice it very clean cleaning is done constantly the city center is about 30 minute walk from the hotel they have a shuttle that can take you there and come back to pick you up it a shame that the shuttle can not pick up after 9 pm and it a shame it not every hour every night we were delivered fresh cooky with a story of bali it really very cute we chose the villa with pool it a very spacious and beautiful room what is a shame is that we hear everything because it is poorly insulated and we couldnt enjoy our private pool a it didnt get the sun a soon a i had a problem they did their best to help me thank you to adiwana staff you made this trip a dream of heaven,"['nothing', 'hello', 'adiwana', 'unagi', 'suites', 'it', 'is', 'not', 'a', 'hotel', 'but', 'a', 'haven', 'of', 'peace', 'surrounded', 'by', 'nature', 'and', 'calm', 'the', 'staff', 'is', 'so', 'nice', 'sweet', 'caring', 'the', 'breakfasts', 'are', 'very', 'good', 'and', 'very', 'neat', 'you', 'get', 'a', 'cold', 'drink', 'a', 'hot', 'drink', 'a', 'plate', 'of', 'fruit', 'croissants', 'and', 'dishes', 'wide', 'choice', 'its', 'very', 'clean', 'cleaning', 'is', 'done', 'constantly', 'the', 'city', 'center', 'is', 'about', '30', 'minutes', 'walk', 'from', 'the', 'hotel', 'they', 'have', 'a', 'shuttle', 'that', 'can', 'take', 'you', 'there', 'and', 'come', 'back', 'to', 'pick', 'you', 'up', 'its', 'a', 'shame', 'that', 'the', 'shuttle', 'can', 'not', 'pick', 'up', 'after', '9', 'pm', 'and', 'its', 'a', 'shame', 'its', 'not', 'every', 'hour', 'every', 'night', 'we', 'were', 'delivered', 'fresh', 'cookies', 'with', 'a', 'story', 'of', 'bali', 'its', 'really', 'very', 'cute', 'we', 'chose', 'the', 'villa', 'with', 'pool', 'its', 'a', 'very', 'spacious', 'and', 'beautiful', 'room', 'what', 'is', 'a', 'shame', 'is', 'that', 'we', 'hear', 'everything', 'because', 'it', 'is', 'poorly', 'insulated', 'and', 'we', 'couldnt', 'enjoy', 'our', 'private', 'pool', 'as', 'it', 'didnt', 'get', 'the', 'sun', 'as', 'soon', 'as', 'i', 'had', 'a', 'problem', 'they', 'did', 'their', 'best', 'to', 'help', 'me', 'thank', 'you', 'to', 'adiwana', 'staff', 'you', 'made', 'this', 'trip', 'a', 'dream', 'of', 'heaven']",adiwana unagi suites,booking.com,one-bedroom villa with private pool,pos
9,marlene,group,4,highly recommended,"dinner more expensive than other restaurants great little houses that are basically built
the staff are very nice and always ask how they are doing the food is excellent
breakfast possible until late afternoon",6/16/2023,austria,6/1/2023,2023,june,2023,june,dinner expensive restaurants great little houses basically built staff nice always ask food excellent breakfast possible late afternoon,dinner more expensive than other restaurant great little house that are basically built the staff are very nice and always ask how they are doing the food is excellent breakfast possible until late afternoon,"['dinner', 'more', 'expensive', 'than', 'other', 'restaurants', 'great', 'little', 'houses', 'that', 'are', 'basically', 'built', 'the', 'staff', 'are', 'very', 'nice', 'and', 'always', 'ask', 'how', 'they', 'are', 'doing', 'the', 'food', 'is', 'excellent', 'breakfast', 'possible', 'until', 'late', 'afternoon']",adiwana unagi suites,booking.com,club room,pos
10,silvia,couple,3,exceptional,nothing staff extremely friendly special mention to gede who won us over the facilities are ideal spacious comfortable and clean the formidable breakfast a place of 10,6/12/2023,spain,6/1/2023,2023,june,2023,june,nothing staff extremely friendly special mention gede us facilities ideal spacious comfortable clean formidable breakfast place 10,nothing staff extremely friendly special mention to gede who won u over the facility are ideal spacious comfortable and clean the formidable breakfast a place of 10,"['nothing', 'staff', 'extremely', 'friendly', 'special', 'mention', 'to', 'gede', 'who', 'won', 'us', 'over', 'the', 'facilities', 'are', 'ideal', 'spacious', 'comfortable', 'and', 'clean', 'the', 'formidable', 'breakfast', 'a', 'place', 'of', '10']",adiwana unagi suites,booking.com,unagi suite,pos
