rating,guest,trip_type,length_of_stay,title,review,review_date,country,stay_date,review_year,review_month,stay_year,stay_month,stopword_text,lemmatized_text,tokenized_text,hotel,channel,room_type,sentiment
10,preema,couple,5,"perfect stay in ubud, ill be recommending this hotel to everyone i know.","nothing everything at the property was amazing from the moment we arrived at the hotel until we checked out the hotel staff were friendly and welcoming and greeted us with a smile at all times the staff were extremely helpful and respectful and ensured that we received excellent service throughout our stay including the laundry service breakfast early in the morning and recommendations to local restaurants hotel and restaurant staff provided quick service

we stayed in the forest view hotel room and the room was spacious with a lovely bath and lovely patio area with a gorgeous view of the greenery around us our hotel room was clean and tidy every day to an excellent standard as an added extra the staff left information about ubud in our room each day and cookies too as well as refreshed the bottles of water tea and the mini fridge 

dedy the supervisor as well as the other staff frequently asked about our stay and provided helpful information including helping us rent a moped for the day as needed and was very friendly and welcoming 

the pool was well maintained fairly big and had a lovely view as well as having sun beds to relax on and offering pool side service for food and drinks 

when we were leaving the hotel staff went the extra mile to help us with our luggage and gave us a little present as a gift for our stay 

the hotel also offered a free photography session in their lovely gardens we didnt get around to using this due to time limits 

on arrival i also received a whatsapp message from the hotel letting me know that i could use whatsapp to ask any questions and get in contact with reception staff",5/15/2023,united kingdom,5/1/2023,2023,may,2023,may,nothing everything property amazing moment arrived hotel checked hotel staff friendly welcoming greeted us smile times staff extremely helpful respectful ensured received excellent service throughout stay including laundry service breakfast early morning recommendations local restaurants hotel restaurant staff provided quick service stayed forest view hotel room room spacious lovely bath lovely patio area gorgeous view greenery around us hotel room clean tidy every day excellent standard added extra staff left information ubud room day cookies well refreshed bottles water tea mini fridge dedy supervisor well staff frequently asked stay provided helpful information including helping us rent moped day needed friendly welcoming pool well maintained fairly big lovely view well sun beds relax offering pool side service food drinks leaving hotel staff went extra mile help us luggage gave us little present gift stay hotel also offered free photography session lovely gardens didnt get around using due time limits arrival also received whatsapp message hotel letting know could use whatsapp ask questions get contact reception staff,nothing everything at the property wa amazing from the moment we arrived at the hotel until we checked out the hotel staff were friendly and welcoming and greeted u with a smile at all time the staff were extremely helpful and respectful and ensured that we received excellent service throughout our stay including the laundry service breakfast early in the morning and recommendation to local restaurant hotel and restaurant staff provided quick service we stayed in the forest view hotel room and the room wa spacious with a lovely bath and lovely patio area with a gorgeous view of the greenery around u our hotel room wa clean and tidy every day to an excellent standard a an added extra the staff left information about ubud in our room each day and cooky too a well a refreshed the bottle of water tea and the mini fridge dedy the supervisor a well a the other staff frequently asked about our stay and provided helpful information including helping u rent a moped for the day a needed and wa very friendly and welcoming the pool wa well maintained fairly big and had a lovely view a well a having sun bed to relax on and offering pool side service for food and drink when we were leaving the hotel staff went the extra mile to help u with our luggage and gave u a little present a a gift for our stay the hotel also offered a free photography session in their lovely garden we didnt get around to using this due to time limit on arrival i also received a whatsapp message from the hotel letting me know that i could use whatsapp to ask any question and get in contact with reception staff,"['nothing', 'everything', 'at', 'the', 'property', 'was', 'amazing', 'from', 'the', 'moment', 'we', 'arrived', 'at', 'the', 'hotel', 'until', 'we', 'checked', 'out', 'the', 'hotel', 'staff', 'were', 'friendly', 'and', 'welcoming', 'and', 'greeted', 'us', 'with', 'a', 'smile', 'at', 'all', 'times', 'the', 'staff', 'were', 'extremely', 'helpful', 'and', 'respectful', 'and', 'ensured', 'that', 'we', 'received', 'excellent', 'service', 'throughout', 'our', 'stay', 'including', 'the', 'laundry', 'service', 'breakfast', 'early', 'in', 'the', 'morning', 'and', 'recommendations', 'to', 'local', 'restaurants', 'hotel', 'and', 'restaurant', 'staff', 'provided', 'quick', 'service', 'we', 'stayed', 'in', 'the', 'forest', 'view', 'hotel', 'room', 'and', 'the', 'room', 'was', 'spacious', 'with', 'a', 'lovely', 'bath', 'and', 'lovely', 'patio', 'area', 'with', 'a', 'gorgeous', 'view', 'of', 'the', 'greenery', 'around', 'us', 'our', 'hotel', 'room', 'was', 'clean', 'and', 'tidy', 'every', 'day', 'to', 'an', 'excellent', 'standard', 'as', 'an', 'added', 'extra', 'the', 'staff', 'left', 'information', 'about', 'ubud', 'in', 'our', 'room', 'each', 'day', 'and', 'cookies', 'too', 'as', 'well', 'as', 'refreshed', 'the', 'bottles', 'of', 'water', 'tea', 'and', 'the', 'mini', 'fridge', 'dedy', 'the', 'supervisor', 'as', 'well', 'as', 'the', 'other', 'staff', 'frequently', 'asked', 'about', 'our', 'stay', 'and', 'provided', 'helpful', 'information', 'including', 'helping', 'us', 'rent', 'a', 'moped', 'for', 'the', 'day', 'as', 'needed', 'and', 'was', 'very', 'friendly', 'and', 'welcoming', 'the', 'pool', 'was', 'well', 'maintained', 'fairly', 'big', 'and', 'had', 'a', 'lovely', 'view', 'as', 'well', 'as', 'having', 'sun', 'beds', 'to', 'relax', 'on', 'and', 'offering', 'pool', 'side', 'service', 'for', 'food', 'and', 'drinks', 'when', 'we', 'were', 'leaving', 'the', 'hotel', 'staff', 'went', 'the', 'extra', 'mile', 'to', 'help', 'us', 'with', 'our', 'luggage', 'and', 'gave', 'us', 'a', 'little', 'present', 'as', 'a', 'gift', 'for', 'our', 'stay', 'the', 'hotel', 'also', 'offered', 'a', 'free', 'photography', 'session', 'in', 'their', 'lovely', 'gardens', 'we', 'didnt', 'get', 'around', 'to', 'using', 'this', 'due', 'to', 'time', 'limits', 'on', 'arrival', 'i', 'also', 'received', 'a', 'whatsapp', 'message', 'from', 'the', 'hotel', 'letting', 'me', 'know', 'that', 'i', 'could', 'use', 'whatsapp', 'to', 'ask', 'any', 'questions', 'and', 'get', 'in', 'contact', 'with', 'reception', 'staff']",adiwana unagi suites,booking.com,adiwana forest view,pos
9,harmeet,couple,4,wonderful,i would suggest some more western food options but apart from that everything was perfect the man who drove the shuttle bus was very friendly and always happy to have a chat all the other staff were also very helpful we managed to get an upgrade to the pool access room for a small amount which is highly recommended,5/14/2023,united kingdom,5/1/2023,2023,may,2023,may,would suggest western food options apart everything perfect man drove shuttle bus friendly always happy chat staff also helpful managed get upgrade pool access room small amount highly recommended,i would suggest some more western food option but apart from that everything wa perfect the man who drove the shuttle bus wa very friendly and always happy to have a chat all the other staff were also very helpful we managed to get an upgrade to the pool access room for a small amount which is highly recommended,"['i', 'would', 'suggest', 'some', 'more', 'western', 'food', 'options', 'but', 'apart', 'from', 'that', 'everything', 'was', 'perfect', 'the', 'man', 'who', 'drove', 'the', 'shuttle', 'bus', 'was', 'very', 'friendly', 'and', 'always', 'happy', 'to', 'have', 'a', 'chat', 'all', 'the', 'other', 'staff', 'were', 'also', 'very', 'helpful', 'we', 'managed', 'to', 'get', 'an', 'upgrade', 'to', 'the', 'pool', 'access', 'room', 'for', 'a', 'small', 'amount', 'which', 'is', 'highly', 'recommended']",adiwana unagi suites,booking.com,unagi suite,pos
10,humaira,couple,4,had a fantastic stay at adiwana.. the staff are brilliant and go out of their way for you. amazing service!! would 100%,"if im being really picky the bathtub in the room has wear and tear and looks as if it needs a replacement same with the bathroom shower tiling however it was all very clean
although it is close to central ubud it is hard to walk as very hilly and taxi or shuttle is better especially at night everyone was so welcoming and kind the nicest group of staff we have ever met the property itself was better than expected and gives jungle vibes although so close to the centre our room was unreal  the bed was comfortable and room had some lovely finishing touches",5/12/2023,united kingdom,5/1/2023,2023,may,2023,may,im really picky bathtub room wear tear looks needs replacement bathroom shower tiling however clean although close central ubud hard walk hilly taxi shuttle better especially night everyone welcoming kind nicest group staff ever met property better expected gives jungle vibes although close centre room unreal bed comfortable room lovely finishing touches,if im being really picky the bathtub in the room ha wear and tear and look a if it need a replacement same with the bathroom shower tiling however it wa all very clean although it is close to central ubud it is hard to walk a very hilly and taxi or shuttle is better especially at night everyone wa so welcoming and kind the nicest group of staff we have ever met the property itself wa better than expected and give jungle vibe although so close to the centre our room wa unreal the bed wa comfortable and room had some lovely finishing touch,"['if', 'im', 'being', 'really', 'picky', 'the', 'bathtub', 'in', 'the', 'room', 'has', 'wear', 'and', 'tear', 'and', 'looks', 'as', 'if', 'it', 'needs', 'a', 'replacement', 'same', 'with', 'the', 'bathroom', 'shower', 'tiling', 'however', 'it', 'was', 'all', 'very', 'clean', 'although', 'it', 'is', 'close', 'to', 'central', 'ubud', 'it', 'is', 'hard', 'to', 'walk', 'as', 'very', 'hilly', 'and', 'taxi', 'or', 'shuttle', 'is', 'better', 'especially', 'at', 'night', 'everyone', 'was', 'so', 'welcoming', 'and', 'kind', 'the', 'nicest', 'group', 'of', 'staff', 'we', 'have', 'ever', 'met', 'the', 'property', 'itself', 'was', 'better', 'than', 'expected', 'and', 'gives', 'jungle', 'vibes', 'although', 'so', 'close', 'to', 'the', 'centre', 'our', 'room', 'was', 'unreal', 'the', 'bed', 'was', 'comfortable', 'and', 'room', 'had', 'some', 'lovely', 'finishing', 'touches']",adiwana unagi suites,booking.com,adiwana pool access,pos
10,jasmin,solo traveler,2,exceptional,everything was perfect great staff,5/8/2023,united states of america,4/1/2023,2023,may,2023,april,everything perfect great staff,everything wa perfect great staff,"['everything', 'was', 'perfect', 'great', 'staff']",adiwana unagi suites,booking.com,club room,pos
10,rajesh,couple,2,the best stay in ubud hands down. you cant beat this resort!,"nothing this was our best stay in bali and we stayed at numerous properties the staff is amazing and gede and mila were fabulous hosts the breakfast is fantastic from elys kitchen and the spa is also really good you really dont need to go out to enjoy bali if you are staying at this resort 

the proximity of the hotel to ubuds main attractions are super close just use grab and get a cab within minutes this is what luxury stays should feel like",5/7/2023,united states of america,5/1/2023,2023,may,2023,may,nothing best stay bali stayed numerous properties staff amazing gede mila fabulous hosts breakfast fantastic elys kitchen spa also really good really dont need go enjoy bali staying resort proximity hotel ubuds main attractions super close use grab get cab within minutes luxury stays feel like,nothing this wa our best stay in bali and we stayed at numerous property the staff is amazing and gede and mila were fabulous host the breakfast is fantastic from elys kitchen and the spa is also really good you really dont need to go out to enjoy bali if you are staying at this resort the proximity of the hotel to ubuds main attraction are super close just use grab and get a cab within minute this is what luxury stay should feel like,"['nothing', 'this', 'was', 'our', 'best', 'stay', 'in', 'bali', 'and', 'we', 'stayed', 'at', 'numerous', 'properties', 'the', 'staff', 'is', 'amazing', 'and', 'gede', 'and', 'mila', 'were', 'fabulous', 'hosts', 'the', 'breakfast', 'is', 'fantastic', 'from', 'elys', 'kitchen', 'and', 'the', 'spa', 'is', 'also', 'really', 'good', 'you', 'really', 'dont', 'need', 'to', 'go', 'out', 'to', 'enjoy', 'bali', 'if', 'you', 'are', 'staying', 'at', 'this', 'resort', 'the', 'proximity', 'of', 'the', 'hotel', 'to', 'ubuds', 'main', 'attractions', 'are', 'super', 'close', 'just', 'use', 'grab', 'and', 'get', 'a', 'cab', 'within', 'minutes', 'this', 'is', 'what', 'luxury', 'stays', 'should', 'feel', 'like']",adiwana unagi suites,booking.com,one-bedroom villa with private pool,pos
10,april,group,4,most wonderful!,i did get a massage at the spa onsite along with 3 friends who all agreed it was average absolutely everything was lovely and id say its the nicest place ive ever stayed will definitely go back the staff the grounds the room the location the included brekky the pools the yoga pavilion was all amazing,5/4/2023,australia,4/1/2023,2023,may,2023,april,get massage spa onsite along 3 friends agreed average absolutely everything lovely id say nicest place ive ever stayed definitely go back staff grounds room location included brekky pools yoga pavilion amazing,i did get a massage at the spa onsite along with 3 friend who all agreed it wa average absolutely everything wa lovely and id say it the nicest place ive ever stayed will definitely go back the staff the ground the room the location the included brekky the pool the yoga pavilion wa all amazing,"['i', 'did', 'get', 'a', 'massage', 'at', 'the', 'spa', 'onsite', 'along', 'with', '3', 'friends', 'who', 'all', 'agreed', 'it', 'was', 'average', 'absolutely', 'everything', 'was', 'lovely', 'and', 'id', 'say', 'its', 'the', 'nicest', 'place', 'ive', 'ever', 'stayed', 'will', 'definitely', 'go', 'back', 'the', 'staff', 'the', 'grounds', 'the', 'room', 'the', 'location', 'the', 'included', 'brekky', 'the', 'pools', 'the', 'yoga', 'pavilion', 'was', 'all', 'amazing']",adiwana unagi suites,booking.com,unagi suite,pos
8,andrea,couple,2,a gemm in ubud,"nothing staff extremely kind and helpful 
restaurant is definitely the best one in bali
structure is very nice good value for money",5/3/2023,italy,5/1/2023,2023,may,2023,may,nothing staff extremely kind helpful restaurant definitely best one bali structure nice good value money,nothing staff extremely kind and helpful restaurant is definitely the best one in bali structure is very nice good value for money,"['nothing', 'staff', 'extremely', 'kind', 'and', 'helpful', 'restaurant', 'is', 'definitely', 'the', 'best', 'one', 'in', 'bali', 'structure', 'is', 'very', 'nice', 'good', 'value', 'for', 'money']",adiwana unagi suites,booking.com,club room,pos
10,anna,couple,4,everything is perfect,nothing everything in this hotel was perfect the service is amazing,5/1/2023,united kingdom,4/1/2023,2023,may,2023,april,nothing everything hotel perfect service amazing,nothing everything in this hotel wa perfect the service is amazing,"['nothing', 'everything', 'in', 'this', 'hotel', 'was', 'perfect', 'the', 'service', 'is', 'amazing']",adiwana unagi suites,booking.com,club room,pos
10,jessica,couple,3,exceptional,no complaints breakfast was fantastic and the staff were amazing we want to specially thank neoman putra and gede they were amazing there was a little mishap but things got sorted in no time which we really appreciated beautiful place to stay would recommend,4/25/2023,united kingdom,4/1/2023,2023,april,2023,april,complaints breakfast fantastic staff amazing want specially thank neoman putra gede amazing little mishap things got sorted time really appreciated beautiful place stay would recommend,no complaint breakfast wa fantastic and the staff were amazing we want to specially thank neoman putra and gede they were amazing there wa a little mishap but thing got sorted in no time which we really appreciated beautiful place to stay would recommend,"['no', 'complaints', 'breakfast', 'was', 'fantastic', 'and', 'the', 'staff', 'were', 'amazing', 'we', 'want', 'to', 'specially', 'thank', 'neoman', 'putra', 'and', 'gede', 'they', 'were', 'amazing', 'there', 'was', 'a', 'little', 'mishap', 'but', 'things', 'got', 'sorted', 'in', 'no', 'time', 'which', 'we', 'really', 'appreciated', 'beautiful', 'place', 'to', 'stay', 'would', 'recommend']",adiwana unagi suites,booking.com,adiwana pool access,pos
8,genevieve,solo traveler,3,"place was fantastic, the food was great and the customer service was amazing.",even though the customer service was great i felt like the staff were in your face all the time the customer service was top notch,4/22/2023,ghana,4/1/2023,2023,april,2023,april,even though customer service great felt like staff face time customer service top notch,even though the customer service wa great i felt like the staff were in your face all the time the customer service wa top notch,"['even', 'though', 'the', 'customer', 'service', 'was', 'great', 'i', 'felt', 'like', 'the', 'staff', 'were', 'in', 'your', 'face', 'all', 'the', 'time', 'the', 'customer', 'service', 'was', 'top', 'notch']",adiwana unagi suites,booking.com,adiwana forest view,pos
9,charlotte,couple,3,incredibly nice stay,"the prices of food drink and massage treatments are quite steep and make you go elsewhere
the laundry service is very expensive to be honest down town we got it done for 16th of the price
the shuttle is very handy and essential because the walk to the town is very far we used it quite a few times however it doesnt run that often the staff was incredibly friendly and attentive the room impeccable clean and the food incl breakfast was of fantastic quality",4/20/2023,netherlands,4/1/2023,2023,april,2023,april,prices food drink massage treatments quite steep make go elsewhere laundry service expensive honest town got done 16th price shuttle handy essential walk town far used quite times however doesnt run often staff incredibly friendly attentive room impeccable clean food incl breakfast fantastic quality,the price of food drink and massage treatment are quite steep and make you go elsewhere the laundry service is very expensive to be honest down town we got it done for 16th of the price the shuttle is very handy and essential because the walk to the town is very far we used it quite a few time however it doesnt run that often the staff wa incredibly friendly and attentive the room impeccable clean and the food incl breakfast wa of fantastic quality,"['the', 'prices', 'of', 'food', 'drink', 'and', 'massage', 'treatments', 'are', 'quite', 'steep', 'and', 'make', 'you', 'go', 'elsewhere', 'the', 'laundry', 'service', 'is', 'very', 'expensive', 'to', 'be', 'honest', 'down', 'town', 'we', 'got', 'it', 'done', 'for', '16th', 'of', 'the', 'price', 'the', 'shuttle', 'is', 'very', 'handy', 'and', 'essential', 'because', 'the', 'walk', 'to', 'the', 'town', 'is', 'very', 'far', 'we', 'used', 'it', 'quite', 'a', 'few', 'times', 'however', 'it', 'doesnt', 'run', 'that', 'often', 'the', 'staff', 'was', 'incredibly', 'friendly', 'and', 'attentive', 'the', 'room', 'impeccable', 'clean', 'and', 'the', 'food', 'incl', 'breakfast', 'was', 'of', 'fantastic', 'quality']",adiwana unagi suites,booking.com,club room,pos
10,sylwia,couple,5,the best stay in bali,all was perfect everything was perfect amazing location and staff superior rooms,4/20/2023,germany,3/1/2023,2023,april,2023,march,perfect everything perfect amazing location staff superior rooms,all wa perfect everything wa perfect amazing location and staff superior room,"['all', 'was', 'perfect', 'everything', 'was', 'perfect', 'amazing', 'location', 'and', 'staff', 'superior', 'rooms']",adiwana unagi suites,booking.com,club room,pos
10,jacinta,couple,3,cant wait to return ,french toast was not french toast only complaint  everything was sensational,4/19/2023,united kingdom,3/1/2023,2023,april,2023,march,french toast french toast complaint everything sensational,french toast wa not french toast only complaint everything wa sensational,"['french', 'toast', 'was', 'not', 'french', 'toast', 'only', 'complaint', 'everything', 'was', 'sensational']",adiwana unagi suites,booking.com,one-bedroom villa with private pool,neg
8,jaycee,group,3,very good,better coffee breakfast option was good staff was attentive selection of coffee can be improved,4/18/2023,singapore,4/1/2023,2023,april,2023,april,better coffee breakfast option good staff attentive selection coffee improved,better coffee breakfast option wa good staff wa attentive selection of coffee can be improved,"['better', 'coffee', 'breakfast', 'option', 'was', 'good', 'staff', 'was', 'attentive', 'selection', 'of', 'coffee', 'can', 'be', 'improved']",adiwana unagi suites,booking.com,club room,pos
10,jessica,couple,2,can highly recommend,nothing everything was great incredibly friendly and helpful staff absolutely exceptional very nice hotel quite super clear beautiful and comfy rooms,4/11/2023,germany,4/1/2023,2023,april,2023,april,nothing everything great incredibly friendly helpful staff absolutely exceptional nice hotel quite super clear beautiful comfy rooms,nothing everything wa great incredibly friendly and helpful staff absolutely exceptional very nice hotel quite super clear beautiful and comfy room,"['nothing', 'everything', 'was', 'great', 'incredibly', 'friendly', 'and', 'helpful', 'staff', 'absolutely', 'exceptional', 'very', 'nice', 'hotel', 'quite', 'super', 'clear', 'beautiful', 'and', 'comfy', 'rooms']",adiwana unagi suites,booking.com,adiwana pool access,pos
9,nora,couple,3,great experience,none beautiful lobby nice n clean room love the pool authentic feel n chill atmosphere,4/9/2023,taiwan,4/1/2023,2023,april,2023,april,none beautiful lobby nice n clean room love pool authentic feel n chill atmosphere,none beautiful lobby nice n clean room love the pool authentic feel n chill atmosphere,"['none', 'beautiful', 'lobby', 'nice', 'n', 'clean', 'room', 'love', 'the', 'pool', 'authentic', 'feel', 'n', 'chill', 'atmosphere']",adiwana unagi suites,booking.com,adiwana pool access,pos
8,bria,couple,6,"good base for ubud, friendly staff","the pool didnt get any sunlight until later in the evening which wasnt ideal for spending time there 
there were few gluten free options on the menu 
some areas of the hotel looked like they could be updated the staff were super friendly and the food was really good in the restaurant the shuttle to the centre was very handy for getting about ubud",4/7/2023,ireland,3/1/2023,2023,april,2023,march,pool didnt get sunlight later evening wasnt ideal spending time gluten free options menu areas hotel looked like could updated staff super friendly food really good restaurant shuttle centre handy getting ubud,the pool didnt get any sunlight until later in the evening which wasnt ideal for spending time there there were few gluten free option on the menu some area of the hotel looked like they could be updated the staff were super friendly and the food wa really good in the restaurant the shuttle to the centre wa very handy for getting about ubud,"['the', 'pool', 'didnt', 'get', 'any', 'sunlight', 'until', 'later', 'in', 'the', 'evening', 'which', 'wasnt', 'ideal', 'for', 'spending', 'time', 'there', 'there', 'were', 'few', 'gluten', 'free', 'options', 'on', 'the', 'menu', 'some', 'areas', 'of', 'the', 'hotel', 'looked', 'like', 'they', 'could', 'be', 'updated', 'the', 'staff', 'were', 'super', 'friendly', 'and', 'the', 'food', 'was', 'really', 'good', 'in', 'the', 'restaurant', 'the', 'shuttle', 'to', 'the', 'centre', 'was', 'very', 'handy', 'for', 'getting', 'about', 'ubud']",adiwana unagi suites,booking.com,adiwana forest view,pos
